{
  "components": {
    "hmmRegime": {
      "producer": "HMM",
      "reason": "MISSING_EVIDENCE",
      "sourceWorkspace": "decision-platform",
      "status": "ABSTAIN"
    },
    "lightgbm": {
      "producer": "LIGHTGBM",
      "reason": "MISSING_EVIDENCE",
      "sourceWorkspace": "decision-platform",
      "status": "ABSTAIN"
    },
    "lstm": {
      "producer": "LSTM",
      "reason": "MISSING_EVIDENCE",
      "sourceWorkspace": "return-engine",
      "status": "ABSTAIN"
    },
    "ruleBaseline": {
      "producer": "RULE_BASELINE",
      "reason": "MISSING_EVIDENCE",
      "sourceWorkspace": "return-engine",
      "status": "ABSTAIN"
    }
  },
  "composite": {
    "reason": "REQUIRED_COMPONENT_UNAVAILABLE",
    "status": "ABSTAIN"
  },
  "symbol": "005930",
  "timeframe": "1d",
  "warnings": [
    "No verified component evidence is available."
  ]
}
